{
  "format": "125A-GUI",
  "version": 1,
  "name": "Colderator Main Snow",
  "asset": {
    "type": "knob"
  },
  "design": {
    "shape": "domed",
    "material": "aluminium",
    "baseColor": "#F7FBFDFF",
    "accentColor": "#86C9E6FF",
    "indicator": {
      "enabled": true,
      "type": "line",
      "color": "#315E74FF",
      "length": 67,
      "width": 3.6
    },
    "expert": {
      "capEnabled": true,
      "sideDetail": "smooth",
      "accentRing": true,
      "indicatorRadialPosition": 73,
      "material": {
        "type": "solid",
        "shininess": 36,
        "reflectivity": 24,
        "brushIntensity": 0
      },
      "layers": [
        {
          "name": "Snow Body",
          "diameter": 100,
          "height": 12,
          "bevelRadius": 6,
          "skirtStyle": "cylindrical",
          "material": {
            "type": "solid",
            "color": "#F8FBFDFF",
            "shininess": 34,
            "reflectivity": 24
          }
        },
        {
          "name": "Ice Cap",
          "diameter": 82,
          "height": 4,
          "bevelRadius": 3,
          "skirtStyle": "cylindrical",
          "material": {
            "type": "solid",
            "color": "#FFFFFFFF",
            "shininess": 52,
            "reflectivity": 34
          }
        }
      ]
    }
  },
  "lighting": {
    "preset": "soft",
    "expert": {
      "azimuth": 318,
      "elevation": 66,
      "aoStrength": 6,
      "intensity": 128
    }
  },
  "output": {
    "frameWidth": 120,
    "frameHeight": 120,
    "frameCount": 128,
    "startAngle": -135,
    "endAngle": 135,
    "layout": "vertical",
    "scaleExports": [
      1,
      1.25,
      1.5,
      2
    ],
    "supersample": 2
  }
}
