{
  "format": "125A-GUI",
  "version": 1,
  "name": "Colderator Utility Snow",
  "asset": {
    "type": "knob"
  },
  "design": {
    "shape": "flat",
    "material": "aluminium",
    "baseColor": "#F4F9FCFF",
    "accentColor": "#9FD3E8FF",
    "indicator": {
      "enabled": true,
      "type": "line",
      "color": "#466F82FF",
      "length": 55,
      "width": 2.7
    },
    "expert": {
      "capEnabled": true,
      "sideDetail": "smooth",
      "accentRing": true,
      "indicatorRadialPosition": 74,
      "material": {
        "type": "solid",
        "shininess": 26,
        "reflectivity": 17,
        "brushIntensity": 0
      },
      "layers": [
        {
          "name": "Utility Body",
          "diameter": 100,
          "height": 12,
          "bevelRadius": 5,
          "skirtStyle": "cylindrical",
          "material": {
            "type": "solid",
            "color": "#F9FCFDFF",
            "shininess": 32,
            "reflectivity": 22
          }
        }
      ]
    }
  },
  "lighting": {
    "preset": "soft",
    "expert": {
      "azimuth": 320,
      "elevation": 65,
      "aoStrength": 7,
      "intensity": 124
    }
  },
  "output": {
    "frameWidth": 72,
    "frameHeight": 72,
    "frameCount": 128,
    "startAngle": -135,
    "endAngle": 135,
    "layout": "vertical",
    "scaleExports": [
      1,
      1.25,
      1.5,
      2
    ],
    "supersample": 2
  }
}
