{
  "format": "125A-GUI",
  "version": 1,
  "name": "Colderator Character Snow",
  "asset": { "type": "knob" },
  "design": {
    "shape": "compact",
    "material": "aluminium",
    "baseColor": "#F6FAFCFF",
    "accentColor": "#B5D8E8FF",
    "indicator": {
      "enabled": true,
      "type": "notch",
      "color": "#416C82FF",
      "length": 57,
      "width": 2.7
    },
    "expert": {
      "capEnabled": true,
      "sideDetail": "smooth",
      "accentRing": true,
      "indicatorRadialPosition": 75,
      "material": {
        "type": "solid",
        "shininess": 30,
        "reflectivity": 20,
        "brushIntensity": 0
      },
      "layers": [
        {
          "name": "Snow Body",
          "diameter": 100,
          "height": 50,
          "bevelRadius": 9,
          "skirtStyle": "cylindrical",
          "material": {
            "type": "solid",
            "color": "#F1F7FAFF",
            "shininess": 22,
            "reflectivity": 16
          }
        },
        {
          "name": "Frost Cap",
          "diameter": 76,
          "height": 15,
          "bevelRadius": 7,
          "skirtStyle": "cylindrical",
          "material": {
            "type": "solid",
            "color": "#FFFFFFFF",
            "shininess": 40,
            "reflectivity": 27
          }
        }
      ]
    }
  },
  "lighting": {
    "preset": "soft",
    "expert": {
      "azimuth": 318,
      "elevation": 60,
      "aoStrength": 34,
      "intensity": 110
    }
  },
  "output": {
    "frameWidth": 88,
    "frameHeight": 88,
    "frameCount": 128,
    "startAngle": -135,
    "endAngle": 135,
    "layout": "vertical",
    "scaleExports": [1, 1.25, 1.5, 2],
    "supersample": 2
  }
}
