{
  "format": "125A-GUI",
  "version": 1,
  "name": "Mechamorph Scale Flat Top",
  "asset": {
    "type": "knob"
  },
  "design": {
    "shape": "compact",
    "material": "metal-dark",
    "baseColor": "#1B1D1EFF",
    "accentColor": "#8C877CFF",
    "indicator": {
      "enabled": true,
      "type": "line",
      "color": "#E6DCC8FF",
      "length": 72,
      "width": 3.2
    },
    "expert": {
      "capEnabled": true,
      "sideDetail": "knurled",
      "accentRing": true,
      "indicatorRadialPosition": 78,
      "indicatorMetallic": false,
      "material": {
        "type": "brushed",
        "shininess": 36,
        "reflectivity": 23,
        "brushDirection": "radial",
        "brushIntensity": 20
      },
      "layers": [
        {
          "name": "Body",
          "diameter": 90,
          "height": 18,
          "bevelRadius": 4,
          "skirtStyle": "cylindrical",
          "sideDetail": "knurled"
        },
        {
          "name": "Cap",
          "diameter": 74,
          "height": 6,
          "bevelRadius": 3,
          "skirtStyle": "cylindrical",
          "sideDetail": "smooth"
        }
      ]
    }
  },
  "lighting": {
    "preset": "neutral",
    "expert": {
      "azimuth": 310,
      "elevation": 76,
      "aoStrength": 22,
      "intensity": 88
    }
  },
  "output": {
    "frameWidth": 220,
    "frameHeight": 220,
    "frameCount": 72,
    "startAngle": -135,
    "endAngle": 135,
    "layout": "vertical",
    "scaleExports": [
      1,
      1.25,
      1.5,
      2
    ],
    "supersample": 2
  }
}
